{
  "schema_version": "1",
  "paper": {
    "slug": "demo-efficientflow",
    "title": "EfficientFlow: Linear-Complexity Attention via Sparse Token Routing"
  },
  "groups": [
    {
      "id": "G001",
      "kind": "group",
      "title": "headline claims",
      "caption": "Abstract assertions about benchmark accuracy and emergent reasoning.",
      "claim_ids": ["C001", "C005"],
      "dominant_type": "result",
      "verdict": "FAIL",
      "color": "#E74C3C",
      "section": "abstract",
      "page_range": [1, 1]
    },
    {
      "id": "G002",
      "kind": "group",
      "title": "memory savings",
      "caption": "The 40 percent memory-reduction claim and its supporting result.",
      "claim_ids": ["C002", "C011"],
      "dominant_type": "result",
      "verdict": "PASS",
      "color": "#2ECC71",
      "section": "abstract+3",
      "page_range": [1, 1]
    },
    {
      "id": "G003",
      "kind": "group",
      "title": "sparse routing method",
      "caption": "The k=8 sparse-routing architecture and its linear-scaling claim.",
      "claim_ids": ["C003", "C007", "C008"],
      "dominant_type": "method",
      "verdict": "PASS",
      "color": "#2ECC71",
      "section": "2",
      "page_range": [1, 1]
    },
    {
      "id": "G004",
      "kind": "group",
      "title": "prior work",
      "caption": "Cited references the paper builds on.",
      "claim_ids": ["C004", "C006"],
      "dominant_type": "prior_work",
      "verdict": "FAIL",
      "color": "#E74C3C",
      "section": "1",
      "page_range": [1, 1]
    },
    {
      "id": "G005",
      "kind": "group",
      "title": "GLUE results",
      "caption": "Reported GLUE accuracy and the comparison vs. baseline.",
      "claim_ids": ["C009", "C010"],
      "dominant_type": "result",
      "verdict": "INCONCLUSIVE",
      "color": "#F1C40F",
      "section": "3",
      "page_range": [1, 1]
    },
    {
      "id": "G006",
      "kind": "group",
      "title": "discussion overreach",
      "caption": "Interpretive claims in the discussion, including the 'we thus prove' overreach.",
      "claim_ids": ["C012", "C013"],
      "dominant_type": "interpretation",
      "verdict": "FAIL",
      "color": "#E74C3C",
      "section": "4",
      "page_range": [1, 1]
    }
  ],
  "claims": [
    {"id": "C001", "kind": "claim", "parent": "G001", "type": "result", "sentence": "EfficientFlow, a sparse attention mechanism that achieves 87.3% F1 on the GLUE benchmark", "hedged": false, "confidence": "high", "verdict": "FAIL", "verdict_confidence": "high", "color": "#E74C3C", "page": 1, "line": 7, "section": "abstract", "evidence": ["paper.txt:7", "paper.txt:32"]},
    {"id": "C002", "kind": "claim", "parent": "G002", "type": "result", "sentence": "reducing memory consumption by 40% relative to standard attention", "hedged": false, "confidence": "high", "verdict": "PASS", "verdict_confidence": "high", "color": "#2ECC71", "page": 1, "line": 8, "section": "abstract"},
    {"id": "C003", "kind": "claim", "parent": "G003", "type": "method", "sentence": "we route tokens through a learned sparse pattern that scales linearly with sequence length", "hedged": false, "confidence": "high", "verdict": "PASS", "verdict_confidence": "medium", "color": "#2ECC71", "page": 1, "line": 10, "section": "abstract"},
    {"id": "C004", "kind": "claim", "parent": "G004", "type": "prior_work", "sentence": "Building on Chen et al. (2024)", "hedged": false, "confidence": "medium", "verdict": "FAIL", "verdict_confidence": "high", "color": "#E74C3C", "page": 1, "line": 9, "section": "abstract"},
    {"id": "C005", "kind": "claim", "parent": "G001", "type": "interpretation", "sentence": "Our method demonstrates that attention sparsity is sufficient for emergent reasoning capability in transformer language models.", "hedged": false, "confidence": "medium", "verdict": "FAIL", "verdict_confidence": "high", "color": "#E74C3C", "page": 1, "line": 11, "section": "abstract"},
    {"id": "C006", "kind": "claim", "parent": "G004", "type": "background_fact", "sentence": "Standard attention has O(n^2) complexity in sequence length n", "hedged": false, "confidence": "high", "verdict": "PASS", "verdict_confidence": "high", "color": "#2ECC71", "page": 1, "line": 17, "section": "1"},
    {"id": "C007", "kind": "claim", "parent": "G003", "type": "method", "sentence": "We use a 12-layer transformer with 768 hidden dimensions", "hedged": false, "confidence": "high", "verdict": "PASS", "verdict_confidence": "medium", "color": "#2ECC71", "page": 1, "line": 26, "section": "2"},
    {"id": "C008", "kind": "claim", "parent": "G003", "type": "method", "sentence": "We propose EfficientFlow, which routes each query token to k=8 key tokens selected by a small router network.", "hedged": false, "confidence": "high", "verdict": "PASS", "verdict_confidence": "medium", "color": "#2ECC71", "page": 1, "line": 24, "section": "2"},
    {"id": "C009", "kind": "claim", "parent": "G005", "type": "result", "sentence": "EfficientFlow achieves an average score of 78.4% across 9 tasks", "hedged": false, "confidence": "high", "verdict": "PASS", "verdict_confidence": "medium", "color": "#2ECC71", "page": 1, "line": 32, "section": "3"},
    {"id": "C010", "kind": "claim", "parent": "G005", "type": "result", "sentence": "a 0.4% improvement over the standard attention baseline", "hedged": false, "confidence": "medium", "verdict": "INCONCLUSIVE", "verdict_confidence": "low", "verdict_reason": "not_retrievable", "color": "#F1C40F", "page": 1, "line": 33, "section": "3"},
    {"id": "C011", "kind": "claim", "parent": "G002", "type": "result", "sentence": "Memory consumption drops 40% at sequence length 4096.", "hedged": false, "confidence": "high", "verdict": "PASS", "verdict_confidence": "medium", "color": "#2ECC71", "page": 1, "line": 35, "section": "3"},
    {"id": "C012", "kind": "claim", "parent": "G006", "type": "interpretation", "sentence": "Our results suggest that learned sparsity recovers most of the performance of dense attention.", "hedged": true, "confidence": "medium", "verdict": "INCONCLUSIVE", "verdict_confidence": "medium", "verdict_reason": "out_of_scope", "color": "#F1C40F", "page": 1, "line": 41, "section": "4"},
    {"id": "C013", "kind": "claim", "parent": "G006", "type": "interpretation", "sentence": "We thus prove that sparsity is sufficient for emergent reasoning.", "hedged": false, "confidence": "high", "verdict": "FAIL", "verdict_confidence": "high", "color": "#E74C3C", "page": 1, "line": 44, "section": "4"}
  ],
  "edges": [
    {"id": "E001", "source": "C009", "target": "C001", "kind": "contradicts", "confidence": "high", "provenance": "paper.txt:32"},
    {"id": "E002", "source": "C001", "target": "C005", "kind": "supports", "confidence": "medium", "provenance": "paper.txt:11"},
    {"id": "E003", "source": "C011", "target": "C002", "kind": "supports", "confidence": "high", "provenance": "paper.txt:35"},
    {"id": "E004", "source": "C008", "target": "C003", "kind": "supports", "confidence": "high", "provenance": "paper.txt:24"},
    {"id": "E005", "source": "C007", "target": "C003", "kind": "supports", "confidence": "medium", "provenance": "paper.txt:26"},
    {"id": "E006", "source": "C004", "target": "C003", "kind": "supports", "confidence": "low", "provenance": "inferred"},
    {"id": "E007", "source": "C001", "target": "C013", "kind": "supports", "confidence": "low", "provenance": "inferred"},
    {"id": "E008", "source": "C012", "target": "C013", "kind": "depends_on", "confidence": "medium", "provenance": "paper.txt:43"}
  ]
}
